timestamp,day,step,status,details
2026-04-10T09:40:47.615088,11,Session startup,Done,Repo checked and folders ensured
2026-04-10T09:40:47.615110,11,Input loading,Done,Required files loaded with GitHub fallback
2026-04-10T09:40:47.615116,11,Optional path handling,Done,Missing Day 10 files handled safely without blocking workflow
2026-04-10T09:40:47.615121,11,Schema validation,Done,Validated required schemas and benchmark columns
2026-04-10T09:40:47.615126,11,Carbon proxy,Done,Created synthetic carbon lane factors
2026-04-10T09:40:47.615131,11,Planning base,Done,Built forecast-policy planning table and warehouse proxy supply
2026-04-10T09:40:47.615137,11,Strategy simulation,Done,"Compared Speed-first, Cost-first, Carbon-first, and Balanced"
2026-04-10T09:40:47.615142,11,Scenario planning,Done,"Simulated demand spike, disruption, budget cut, capacity shock, and service tightening"
2026-04-10T09:40:47.615148,11,Governance outputs,Done,"Generated assumptions, model risk, decision rules, transfer logic, KPI tree, and architecture summary"
2026-04-10T09:40:47.615153,11,Reporting,Done,"Saved visuals, executive narrative, and sustainability narrative"
2026-04-10T14:45:33.402067,11,Visuals,Done,Saved sustainability charts and strategy scorecard
2026-04-10T14:45:33.402078,11,Executive narrative,Done,Saved day11_narrative.txt
2026-04-10T14:45:33.402081,11,Sustainability narrative,Done,Saved sustainability_narrative.txt
2026-04-10T14:45:33.402084,11,Narrative patch,Done,Saved day11_5_narrative_patch.txt
2026-04-10T14:45:33.402086,11,Save outputs,Done,"Saved benchmark, governance, and reporting outputs"
